Task_ID,Task_Name,Assignee,Status,Start_Date,End_Date,Priority,Campaign,Component,Dependencies,Deliverables,Estimated_Hours,Actual_Hours,Notes,Blockers
T001,Alpha Tile Set Generation,Tech Architect Alpha + Miyamoto,COMPLETED,2026-03-02,2026-03-02,HIGH,Coral Front,Tiles,,21 tiles + demo grid + docs,6,4,Clean geometric approach selected,
T002,Beta Tile Set Generation,Tech Architect Beta + Kojima,COMPLETED,2026-03-02,2026-03-02,MEDIUM,Coral Front,Tiles,,23 tiles + procedural approach,6,4,Comprehensive atmospheric set,
T003,Gamma Tile Set Generation,Tech Architect Gamma + Ikeda,COMPLETED,2026-03-02,2026-03-02,MEDIUM,Coral Front,Tiles,,20 tiles + retro approach,6,4,Hardcore arcade authenticity,
T004,Delta Tile Set Generation,Tech Architect Delta + Okamoto,COMPLETED,2026-03-02,2026-03-02,MEDIUM,Coral Front,Tiles,,16 tiles + minimalist approach,6,3,Clean modern indie style,
T005,Tile Approach Evaluation,Arcade GM,COMPLETED,2026-03-03,2026-03-03,HIGH,All,Decision,T001-T004,Alpha approach selection,2,1,Alpha chosen for production,
T006,Jungle Spear Tile Generation,Codex Session warm-reef,COMPLETED,2026-03-03,2026-03-03,HIGH,Jungle Spear,Tiles,T005,Full tile set using Alpha approach,8,1.0,Codex completed deliverables; gateway notify failed,
T007,Dust Convoy Tile Generation,Codex Session plaid-lobster,COMPLETED,2026-03-03,2026-03-03,HIGH,Dust Convoy,Tiles,T005,Full tile set using Alpha approach,8,1.0,Codex completed deliverables; gateway notify failed,
T008,Iron Monsoon Tile Generation,Codex Session swift-forest,COMPLETED,2026-03-03,2026-03-03,HIGH,Iron Monsoon,Tiles,T005,Full tile set using Alpha approach,8,1.0,Codex completed deliverables; gateway notify failed,
T009,Level Editor - Core Framework,Codex Session glow-haven,COMPLETED,2026-03-03,2026-03-03,HIGH,All,Editor,T005,HTML/JS level editor foundation,12,1.2,Codex completed deliverables; gateway notify failed,
T010,Level Editor - Tile Integration,Codex Session dawn-lagoon,COMPLETED,2026-03-03,2026-03-03,HIGH,All,Editor,T006-T008 + T009,Load and display all campaign tiles,6,1.1,Codex completed deliverables; gateway notify failed,
T011,Level Editor - Auto-tiling System,Codex Session crisp-harbor,COMPLETED,2026-03-03,2026-03-03,MEDIUM,All,Editor,T010,Edge-matching automation,8,1.1,Codex completed deliverables; gateway notify failed,
T012,Production Pipeline Setup,Codex Session clear-reef,COMPLETED,2026-03-03,2026-03-03,HIGH,All,Pipeline,T005,Automated tile generation scripts,4,1.0,Codex completed deliverables; gateway notify failed,
T013,Game Engine Integration,Codex Session gentle-tidepool,COMPLETED,2026-03-03,2026-03-03,HIGH,All,Engine,T006-T008,Update 1942 to use new tiles,10,1.2,Codex completed deliverables; gateway notify failed,
T014,Level Data Migration,Codex Session kind-ridge,COMPLETED,2026-03-03,2026-03-03,MEDIUM,All,Data,T013,Convert existing levels to new format,6,1.0,Codex completed deliverables; gateway notify failed,
T015,Enemy Wave System Refactor,arcade-dev-01,IN_PROGRESS,2026-03-03,2026-03-05,HIGH,All,Gameplay,T013-T014,Deterministic wave scheduler and rebalanced spawn tables across campaigns,14,0,Codex Spark execution wave active implementation kickoff,
T016,Player Weapon Balance and Hitbox Tuning,arcade-dev-02,IN_PROGRESS,2026-03-03,2026-03-05,HIGH,All,Combat,T013,Weapon fire rate and damage pass with collision hitbox tuning and telemetry hooks,12,0,Codex Spark execution wave active implementation kickoff,
T017,Stage Flow and Checkpoint Validation,arcade-dev-03,IN_PROGRESS,2026-03-03,2026-03-06,MEDIUM,All,Levels,T014-T015,Playable stage flow with checkpoint recovery validation for all campaigns,10,0,Codex Spark execution wave active implementation kickoff,
